tour_id,reported_by,type,severity,description,status,photo_urls,guide_id,resolution_notes
TOUR-001,GUIDE-001,vehicle_breakdown,high,"Van wouldn't start this morning. Battery dead. Had to call for jump start from operations.",resolved,"[\"https://cloudinary.com/incident1.jpg\"]",GUIDE-001,"Operations provided jump start. Tour delayed 25 min but completed successfully."
TOUR-002,GUIDE-002,medical,medium,"Guest felt dizzy during hike to cenote. Possible dehydration. Gave water and rest.",resolved,"[\"https://cloudinary.com/incident2.jpg\"]",GUIDE-002,"Guest recovered after 30 min rest. Completed tour with no further issues."
TOUR-003,GUIDE-003,delay,low,"Traffic jam on highway 307. Construction zone. Running 20 min behind schedule.",resolved,[],GUIDE-003,"Alternative route found. Made up time. Tour on schedule by lunch."
TOUR-004,GUIDE-004,guest_complaint,medium,"Guest upset about cenote being closed due to maintenance. Had to substitute with different cenote.",resolved,[],GUIDE-004,"Explained situation. Guest understood. Alternative cenote was actually better. Guest happy."
TOUR-005,GUIDE-005,weather,high,"Sudden tropical storm. Had to take shelter in restaurant for 45 min. Lightning very close.",resolved,"[\"https://cloudinary.com/incident5a.jpg\",\"https://cloudinary.com/incident5b.jpg\"]",GUIDE-005,"Storm passed. Tour resumed. Completed all activities with modified schedule."
